{
  "schema_version": 1,
  "receipt_id": "HDR-brainstorm-adapter-demo",
  "request_id": "ARQ-brainstorm-adapter-demo",
  "session_ref": "brainstorm:bs-20990101-000000-aabbcc",
  "decision_packet_ref": "decision:DCP-brainstorm-adapter-demo",
  "action": "accepted",
  "decision_id": "DEC-003",
  "decider": "user",
  "producer_ref": "producer:synthetic-user",
  "producer_confirmed": true,
  "host_record_ref": "brainstorm:bs-20990101-000000-aabbcc#DEC-003",
  "host_record_confirmed": true,
  "recorded_at": "2026-08-27T18:45:00+08:00"
}
